{
  "schema_version": "1.1",
  "candidate_id": "EVAL-04",
  "result_status": "insight_proposed",
  "insight": {
    "schema_version": "1.1",
    "insight_id": "EI-LAYERED_AUTH_001",
    "title": "网络访问、身份认证、能力授权和用户意图确认必须独立建模",
    "primary_type": "pattern",
    "secondary_types": [
      "judgment",
      "checklist"
    ],
    "generalized_problem": "系统把网络可达性、调用者认证、能力授权和用户批准视为同一权限开关，导致错误的安全与自动化预期。",
    "underlying_mechanism": "不同控制层由不同主体执行并保护不同风险：网络层控制可达性，认证层确认主体，授权层限制能力，用户确认层表达本次意图，运行时策略约束实际执行。",
    "principle": "权限设计必须分层建模、分别配置和逐层验证，不能通过放开其中一层替代其他层。",
    "applicability": {
      "contexts": [
        "外部工具调用",
        "多层网关",
        "代理执行系统",
        "高风险自动化"
      ],
      "preconditions": [
        "请求会穿越多个信任或产品边界",
        "至少存在网络、身份或用户确认中的两层控制"
      ],
      "exclusions": [
        "完全离线且单一信任域内的纯本地函数调用可能不需要所有层，但仍应明确省略理由"
      ]
    },
    "recommended_actions": [
      "绘制请求经过的权限层及每层控制主体。",
      "为网络可达、身份认证、能力授权、用户确认和运行时策略分别定义测试。",
      "优化审批体验时保持身份认证和能力授权不被隐式移除。"
    ],
    "prevention_checks": [
      "服务可访问是否被错误等同于调用者已认证？",
      "调用者已认证是否被错误等同于拥有目标能力？",
      "拥有能力是否被错误等同于用户同意本次操作？",
      "用户同意后运行时策略是否仍能拒绝不安全操作？"
    ],
    "evidence_strength": "high",
    "maturity_level": "provisional",
    "lifecycle_status": "active",
    "maturity_rationale": "The source event and corrective verification support a reusable proposal, but only one governed occurrence is available and formal promotion has not been approved.",
    "lifecycle_rationale": null,
    "source_references": [
      {
        "source_id": "SRC-E04-NET",
        "type": "runtime_observation",
        "reference": "Anonymous tunnel plus bearer-protected gateway verification",
        "supports": "网络入口匿名与 API Bearer 认证同时存在。",
        "confidence": "high"
      },
      {
        "source_id": "SRC-E04-UI",
        "type": "screenshot",
        "reference": "Formal action approval UI and successful call",
        "supports": "API 认证成功后仍存在独立平台用户批准。",
        "confidence": "high"
      },
      {
        "source_id": "SRC-E04-DOC",
        "type": "document",
        "reference": "Consequential-operation behavior research",
        "supports": "只读操作声明影响平台审批而不替代 API 认证。",
        "confidence": "medium"
      }
    ],
    "occurrences": [
      {
        "occurrence_id": "OCC-LAYERED_AUTH_001-001",
        "observed_on": "2026-07-30",
        "context_summary": "一次权限讨论将网络、API 和界面审批混同，实际验证表明它们是独立控制层。",
        "source_refs": [
          "SRC-E04-NET",
          "SRC-E04-UI",
          "SRC-E04-DOC"
        ],
        "independent_evidence": true,
        "notes": null
      }
    ],
    "deduplication": {
      "status": "unverified",
      "decision": "undetermined",
      "compared_insight_ids": [],
      "notes": "The governed insight index was not available in this isolated pilot eval; no uniqueness claim is made."
    },
    "related_insights": [],
    "governance": {
      "requires_human_approval": true,
      "approval_status": "pending",
      "approval_reference": null,
      "requested_actions": [
        "Review the abstraction, boundaries, maturity, and downstream placement before formal adoption."
      ]
    },
    "revision_history": [
      {
        "revision": "0.1",
        "date": "2026-07-31",
        "change_type": "created",
        "summary": "Created during the first controlled pilot evaluation.",
        "source_refs": [
          "SRC-E04-NET",
          "SRC-E04-UI",
          "SRC-E04-DOC"
        ]
      }
    ]
  },
  "quality_gates": {
    "evidence": {
      "status": "pass",
      "notes": "The disposition follows the supplied evidence without inventing facts."
    },
    "abstraction": {
      "status": "pass",
      "notes": "The result identifies a transferable mechanism rather than repeating one implementation."
    },
    "boundary": {
      "status": "pass",
      "notes": "Applicable contexts, preconditions, and exclusions are explicit."
    },
    "actionability": {
      "status": "pass",
      "notes": "The result contains executable actions or prevention checks."
    },
    "deduplication": {
      "status": "pass",
      "notes": "No governed index was available; the result marks uniqueness as unverified."
    },
    "maturity": {
      "status": "pass",
      "notes": "The maturity level is conservative for the number and quality of occurrences."
    },
    "traceability": {
      "status": "pass",
      "notes": "Claims and occurrence records retain stable source references."
    },
    "governance": {
      "status": "pass",
      "notes": "Formal adoption and promotion remain pending human review."
    }
  },
  "unresolved_uncertainties": [],
  "missing_evidence": [],
  "downstream_placement_suggestions": [
    {
      "asset_type": "engineering_standard",
      "target_hint": "外部调用权限分层模型",
      "rationale": "该模型适合成为安全设计与 Action 审查的统一检查项。",
      "requires_human_approval": true
    }
  ],
  "rejection_reason": null,
  "governance_summary": "This is a governed proposal only. It may be reviewed for later placement, but it is not yet an adopted cross-project engineering rule."
}
